Game Name,Away Team,Home Team,Cutoff Time,Away Odds,Home Odds
WAS Wizards v CHI Bulls,CHI Bulls,WAS Wizards,2024-11-27T00:10:00Z,-191,168
MIA Heat v MIL Bucks,MIL Bucks,MIA Heat,2024-11-27T00:30:00Z,119,-134
MIN Timberwolves v HOU Rockets,HOU Rockets,MIN Timberwolves,2024-11-27T01:10:00Z,139,-156
UTA Jazz v SAS Spurs,SAS Spurs,UTA Jazz,2024-11-27T02:10:00Z,-130,117
PHX Suns v LAL Lakers,LAL Lakers,PHX Suns,2024-11-27T03:00:00Z,118,-132
DAL Mavericks v MEM Grizzlies,MEM Grizzlies,DAL Mavericks,2024-12-04T01:30:00Z,0,0
