Game Name,Away Team,Home Team,Cutoff Time,Away Odds,Home Odds
WAS Wizards v CHA Hornets,CHA Hornets,WAS Wizards,2024-12-27T00:00:00Z,-185,163
IND Pacers v OKC Thunder,OKC Thunder,IND Pacers,2024-12-27T00:10:00Z,-207,181
ORL Magic v MIA Heat,MIA Heat,ORL Magic,2024-12-27T00:10:00Z,-104,-106
ATL Hawks v CHI Bulls,CHI Bulls,ATL Hawks,2024-12-27T00:40:00Z,217,-251
MEM Grizzlies v TOR Raptors,TOR Raptors,MEM Grizzlies,2024-12-27T01:10:00Z,495,-653
MIL Bucks v BKN Nets,BKN Nets,MIL Bucks,2024-12-27T01:10:00Z,392,-492
NO Pelicans v HOU Rockets,HOU Rockets,NO Pelicans,2024-12-27T01:10:00Z,-301,255
POR Trail Blazers v UTA Jazz,UTA Jazz,POR Trail Blazers,2024-12-27T03:10:00Z,107,-119
SAC Kings v DET Pistons,DET Pistons,SAC Kings,2024-12-27T03:10:00Z,192,-221
